title,source,score,url,date
Warsh said to unveil Fed task force details soon,biztoc.com,-1.0,https://biztoc.com/x/d899976f86d01d06,2026-06-29
"President Trump will not get what he wants from Kevin Warsh, a source tells us, as inflation will force the Fed upwards",fortune,-1.0,https://fortune.com/2026/06/29/president-trump-kevin-warsh-inflation-fed-rates/,2026-06-29
"US Stock Market: Warsh faces crucial week with court ruling, global debut in focus",the times of india,-1.0,https://economictimes.indiatimes.com/markets/us-stocks/news/us-stock-market-warsh-faces-crucial-week-with-court-ruling-global-debut-in-focus/articleshow/132064200.cms,2026-06-29
"Dollar poised for best month in nearly a year; eyes on Gulf tension, jobs data",cna,-1.0,https://www.channelnewsasia.com/business/dollar-poised-best-month-in-nearly-year-eyes-gulf-tension-jobs-data-6217181,2026-06-29
2 Sneaky Ways Fed Chair Kevin Warsh and the FOMC Can Raise Interest Rates Without Adjusting the Federal Funds Rate,biztoc.com,-1.0,https://biztoc.com/x/202a7f9473f469b3,2026-06-28
Federal Reserve Chairman Kevin Warsh disrupts emerging-market bond recovery,crypto briefing,-1.0,https://cryptobriefing.com/warsh-fed-disrupts-emerging-market-bonds/,2026-06-28
Report: 73 percent of Americans say they’re okay financially,charleston post courier,-1.0,https://www.postandcourier.com/business/federal-reserve-financial-wellbeing-report-americans/article_b8a17aa0-9bb2-4d70-895f-119ba351d9f6.html,2026-06-28
"President Trump will not get what he wants from Kevin Warsh, a source tells us, as inflation will force the Fed upwards",fortune,-1.0,https://fortune.com/2026/06/29/president-trump-kevin-warsh-inflation-fed-rates/,2026-06-29
"President Trump will not get what he wants from Kevin Warsh, a source tells us, as inflation will force the Fed upwards",biztoc.com,-1.0,https://biztoc.com/x/e61a8d3e2079deec,2026-06-29
"President Trump will not get what he wants from Kevin Warsh, a source tells us, as inflation will force the Fed upwards",fortune,-1.0,https://fortune.com/2026/06/29/president-trump-kevin-warsh-inflation-fed-rates/,2026-06-29
