title,source,score,url,date
"Federal Reserve Chair Warsh emphasizes political independence, signals focus on inflation",abcnews.com,-1.0,https://abcnews.com/US/wireStory/federal-reserve-chair-warsh-emphasizes-political-independence-signals-134375712,2026-07-01
"Warsh Says Inflation Risks Are Down, Vows Price Stability",financial post,-1.0,https://financialpost.com/pmn/business-pmn/warsh-says-inflation-risks-are-down-vows-price-stability,2026-07-01
Warsh: Fed will remain independent after SCOTUS ruling,biztoc.com,-1.0,https://biztoc.com/x/2ddddd0554460cc1,2026-07-01
Warsh open to Fed balance sheet changes,biztoc.com,-1.0,https://biztoc.com/x/452f190d28f4b98d,2026-07-01
Warsh warns investors not to expect hints at future Fed interest-rate moves,biztoc.com,-1.0,https://biztoc.com/x/b1a87a3c13b79efe,2026-07-01
Fed Chair Warsh signals potential rate hikes as inflation stays high,crypto briefing,-1.0,https://cryptobriefing.com/fed-chair-warsh-signals-potential-rate-hikes-as-inflation-stays-high/,2026-07-01
"Bitcoin climbs toward $60,000 after Fed Chair Warsh said inflation risks has come down",coindesk,-1.0,https://www.coindesk.com/markets/2026/07/01/bitcoin-retakes-usd60-000-level-after-fed-chair-warsh-said-inflation-risks-has-come-down,2026-07-01
"Fed Chairman Warsh Says Inflation Risks Have Come Down, Vows to Remain Independent",biztoc.com,-1.0,https://biztoc.com/x/60a1918f6eda8af0,2026-07-01
Fed’s Warsh says central bank will uphold its mandate after Cook ruling,crypto briefing,-1.0,https://cryptobriefing.com/fed-warsh-cook-ruling-independence/,2026-07-01
"Fed Chair Warsh stresses political independence, focuses on inflation",medianewsgroup.com,-1.0,https://wirehub.medianewsgroup.com/2026/07/01/new-federal-reserve-chair-warsh-emphasizes-political-independence-signals-focus-on-inflation/,2026-07-01
