title,source,score,url,date
Dollar Recovers as Euro Retreats on Dovish Lagarde Comments,biztoc.com,1.0,https://biztoc.com/x/84fa3129a25f1a56,2026-06-22
2-year Treasury note yield hits highest since February 2025 - CNBC,slashdot.org,-1.0,https://slashdot.org/firehose.pl?op=view&amp;id=184032766,2026-06-22
Alan Greenspan’s financial deregulation agenda set the scene for Ireland’s financial crash,the irish times,-1.0,https://www.irishtimes.com/business/economy/2026/06/22/alan-greenspans-financial-deregulation-agenda-set-the-scene-for-irelands-financial-crash/,2026-06-22
"In 6 Words, Fed Chair Kevin Warsh Just Dropped the Hammer on Wall Street - The Motley Fool",slashdot.org,-1.0,https://slashdot.org/firehose.pl?op=view&amp;id=184032474,2026-06-22
"Bitcoin price rebounds to $65K as oil falls, but US market data still blocks the all-clear",cryptoslate,-1.0,https://cryptoslate.com/?p=543451,2026-06-22
Ex-US Fed Reserve chair Alan Greenspan dies at 100,the punch,-1.0,https://punchng.com/ex-us-fed-reserve-chair-alan-greenspan-dies-at-100/,2026-06-22
Former US Fed chair Alan Greenspan dead at 100,vanguard,-1.0,https://www.vanguardngr.com/2026/06/former-us-fed-chair-alan-greenspan-dead-at-100/,2026-06-22
Former US Federal Reserve Chairman Alan Greenspan dies at age 100,al jazeera english,-1.0,https://www.aljazeera.com/economy/2026/6/22/former-us-federal-reserve-chairman-alan-greenspan-dies-at-age-100,2026-06-22
"Alan Greenspan, Fed Chairman During Boom Years Prior to Subprime Mortgage Crisis, Dies at 100",biztoc.com,-1.0,https://biztoc.com/x/789c7cb92aea69bf,2026-06-22
Iranian Oil Is About to Flood the Market. Has the Fed’s Biggest Pressure Valve Been Released?,24/7 wall st.,-1.0,https://247wallst.com/investing/2026/06/22/iranian-oil-is-about-to-flood-the-market-has-the-feds-biggest-pressure-valve-been-released/,2026-06-22
