title,source,score,url,date
US Stock Market: Warsh reshapes Fed playbook with leaner messaging and reform agenda,the times of india,-1.0,https://economictimes.indiatimes.com/markets/us-stocks/news/us-stock-market-warsh-reshapes-fed-playbook-with-leaner-messaging-and-reform-agenda/articleshow/131901239.cms,2026-06-22
Barclays Warns Hawkish Central Banks Could Challenge Equity Market Momentum,advfn.com,-1.0,https://investorshub.advfn.com/market-news/article/30831/barclays-warns-hawkish-central-banks-could-challenge-equity-market-momentum,2026-06-21
"Kevin Warsh, The Fed, And The Soft Bigotry Of Low Expectations",forbes,-1.0,https://www.forbes.com/sites/johntamny/2026/06/21/kevin-warsh-the-fed-and-the-soft-bigotry-of-low-expectations/,2026-06-21
Lion’s Den Australian Politics: Pauline Hanson at the National Press Club,globalresearch.ca,-1.0,https://www.globalresearch.ca/pauline-hanson-national-press-club/5930827,2026-06-21
Sunday Summary: No Surprises at Kevin Warsh’s First Fed Meeting,commercial observer,-1.0,http://commercialobserver.com/2026/06/sunday-summary-no-surprises-at-kevin-warshs-first-fed-meeting/,2026-06-21
How Fed Chairman Kevin Warsh just screwed AI tech beasts,yahoo entertainment,-1.0,https://finance.yahoo.com/markets/article/how-fed-chairman-kevin-warsh-just-screwed-ai-tech-beasts-103000167.html,2026-06-21
'Regime change but in a velvet glove': How Kevin Warsh has set out to remake the Fed,cnbc,-1.0,https://www.cnbc.com/2026/06/21/how-kevin-warsh-has-set-out-to-remake-the-fed.html,2026-06-21
What to Expect in Markets This Week: A Post-Fed Inflation Reading and Earnings From a Hot Memory Maker,investopedia,-1.0,https://www.investopedia.com/what-to-expect-in-markets-this-week-a-post-fed-inflation-reading-and-earnings-from-a-hot-memory-maker-stock-12001591,2026-06-21
US Federal Reserve sees faster inflation in latest gauge update,crypto briefing,-1.0,https://cryptobriefing.com/fed-pce-inflation-gauge-april-2026/,2026-06-20
Who needs rate cuts? Even the Fed’s new chair admits companies are easily raising capital on financial markets amid epic stock and debt binge,fortune,-1.0,https://fortune.com/2026/06/20/fed-rate-cuts-kevin-warsh-ipo-stock-debt-binge-corporate-bonds/,2026-06-20
